parte2/resultados_angular_ch1.json

{
  "A2": 0.033116528246387146,
  "A4": -0.0622034043576705,
  "data": [
    {
      "angle": 112.5,
      "label": "112.5\u00b0",
      "total_counts": 255363,
      "live_time": 172204.0,
      "rate_cps": 1.4829098046502984,
      "area_1332": 5240.430827062836,
      "area_norm_cps": 0.030431527880088943,
      "x0": 203.90797500329728,
      "sigma": 3.7465312626498433,
      "chi2_red": 3.157903512549182
    },
    {
      "angle": 135.0,
      "label": "135\u00b0",
      "total_counts": 302161,
      "live_time": 172658.0,
      "rate_cps": 1.7500550220667446,
      "area_1332": 5197.8375278112335,
      "area_norm_cps": 0.030104817198225588,
      "x0": 203.98140398061403,
      "sigma": 3.7609630283829176,
      "chi2_red": 2.9113948532389253
    },
    {
      "angle": 157.5,
      "label": "157.5\u00b0",
      "total_counts": 439764,
      "live_time": 258852.0,
      "rate_cps": 1.6989013026748876,
      "area_1332": 8178.757588995967,
      "area_norm_cps": 0.03159626964055123,
      "x0": 204.03677052240513,
      "sigma": 3.7640762534485788,
      "chi2_red": 5.378025463392583
    },
    {
      "angle": 22.5,
      "label": "22.5\u00b0",
      "total_counts": 452701,
      "live_time": 257547.0,
      "rate_cps": 1.7577413054704578,
      "area_1332": 8411.943677847828,
      "area_norm_cps": 0.03266178087047346,
      "x0": 203.67409995972065,
      "sigma": 3.837946036818781,
      "chi2_red": 5.6956151800708685
    },
    {
      "angle": 45.0,
      "label": "45\u00b0",
      "total_counts": 274515,
      "live_time": 172902.0,
      "rate_cps": 1.587691293333796,
      "area_1332": 5429.396950933408,
      "area_norm_cps": 0.031401585585669384,
      "x0": 203.9947635638718,
      "sigma": 3.742920684523213,
      "chi2_red": 3.6784636453998263
    },
    {
      "angle": 67.5,
      "label": "67.5\u00b0",
      "total_counts": 269303,
      "live_time": 171995.0,
      "rate_cps": 1.5657606325765283,
      "area_1332": 5624.342340542058,
      "area_norm_cps": 0.03270061536987737,
      "x0": 204.12614056618142,
      "sigma": 3.9343413291950027,
      "chi2_red": 3.12637812475802
    },
    {
      "angle": 90.0,
      "label": "90\u00b0",
      "total_counts": 400815,
      "live_time": 259698.0,
      "rate_cps": 1.543388859367419,
      "area_1332": 7620.771540924102,
      "area_norm_cps": 0.02934474482254042,
      "x0": 204.0691209463853,
      "sigma": 3.773547429214566,
      "chi2_red": 4.437753189752571
    },
    {
      "angle": 180.0,
      "label": "180\u00b0",
      "total_counts": 182656,
      "live_time": 170965.0,
      "rate_cps": 1.0683824174538648,
      "area_1332": 4815.477379991763,
      "area_norm_cps": 0.028166451495872036,
      "x0": 205.26146179712234,
      "sigma": 3.793274730413553,
      "chi2_red": 2.080223737279973
    }
  ]
}

proyecto.md

Borde de la regla: extremo de fuera del soporte de la fuente verde. La medida que tomamos de referencia para colocar el detector ya hemos dicho que es la del acoplamiento de las dos partes: 500 mm. Para saber la distancia fuente detector debemos medir el tamaño del elemento que contiene el cristal y después debemos restar la mitad de la distancia del ancho de la plancha verde donde se sitúa la fuerte. 
Estamos intentando que no aparezca el 40K (fuente de coincidencia aleatoria) para ello, intentamos que el blindaje quede colocado de la misma manera en ambos detectores. Ahora colocaremos nuestra fuente de 22-Na y haremos la primera medida. Hay que poner coincidencia en nuestro programa. En el canal 300, para el 22-Na tiene que salir (el Na se desintegra en \beta+ y cae a un gas noble (Ne), cae a un estado excitado, a un 99% de probabilidad, se desexcita y emite un fotón de …KeV. La otra opción es que la energía de excitación del núcleo pase a un electrón orbital. Emisión entonces de un electrón, que tendrá una energía cinética que es igual a la diferencia entre la energía de excitación y de ionización del átomo. 
Vamos ahora a ver qué es lo que medimos para el ángulo correspondiente a la siguiente posición.
Vamos a comprobar qué efectos no existen o que, si existen, no los estamos detectando.
Vamos a hacer entonces la medida para 22-Na, en coincidencia, colocando un detector en P2 (180º-22.5º pues el ángulo entre divisiones es 22.5º) y el otro en el extremo contrario.

El pico que vemos NO sólo da coincidencias reales. Estas no están correlacionadas angularmente con el fotón de 511. Todo lo que sea coincidencia con el de 1274 no se puede considerar como coincidencia aleatoria. Debemos ver la relación de áreas, lo que proporcionará las coincidencias aleatorias. Salvamos el 2º espectro de sodio 22 de ángulo 180-22.5º.

¿Por qué no vemos los dos picos? Vamos a ver qué es lo que ocurre colocando los 2 detectores enfrentados y poniendo las muestras pegadas a ellos. Sólo sale un pico y sale al final. Vamos a pensar, antes de mover nada vamos a ver si aumentando la amplificación y cambiando la ganancia (osciloscopio->ganancia) podemos verlo de manera menos apelotonada. Vemos ahora los 2 picos. Era entonces un problema de que, haciendo cambios para intentar quitarnos toda la parte de continuo a baja energía, (antes de los picos) cambiamos el offset y pusimos demasiado. Luego la medida no sirvió de nada y tenemos que volver a empezar HAHAHAHAHAHA. Para tomar correctamente la medida tenemos que cambiar la ganancia, ponemos 2.080 canal 0 , 2.200 canal1. El offset además lo hemos dejado al 5%. Medimos Na22 a 180 grados y Na22 en la siguiente posición. Con eso intentamos determinar las coincidencias aleatorias del Na22 comparando la medida en la segunda posición (157.5) con la de 180 grados. Lo que midamos en la segunda tendrá la coincidencia del Na y el scattering. No puede haber coincidencia verdadera. Lo otro que tenemos que eliminar es la coincidencia entre un evento del fondo del laboratorio y uno de la fuente de 60Co. Esa será la medida que dejemos, a 90 grados y dejando un ladrillo delante de uno de los detectores, ara que la medida sea solamente el fondo del detector.
Medida de coincidencia entre fuente de Co60 y el fondo. Esta tarde se cambia esa y se deja únicamente la del fondo para ver cuántos eventos son de coincidencia. En el pico está claro que se trata de coincidencia verdadera o aleatoria propia del Na. Si no eliminamos el Compton no podemos distinguir entre coincidencia verdadera y el Compton. Queremos distinguir entre l que se absorbe realmente y el Compton. De eso se trata, de ver si podemos ir eliminando del fondo las coincidencias que no son verdaderas para poder usar todo el continuo y no solo los picos.
Los espectros que tenemos hasta ahora día 4 de mayo no sirven de nada. Vamos a hacer ahora una carpeta común con el grupo de la tarde que contendrá las medidas válidas. 
Vamos a la pizarra. Vamos a poner ahí las medidas que hay que hacer. 
CALENDARIO DE MEDIDAS MIENTRAS VIENE ALBERTO:
YA HA VENIDO ALBERTO PERO VAMOS A HACER EL CALENDARIO DE MEDIDAS EN LO QUE COLOCA LA FUENTE. 
CALENDARIO DE MEDIDAS EN LO QUE ALBERTO HACE SU TRABAJO (criar a las supernenas): Planificación de medidas las medidas a realizar en la práctica de correlación angular entre las emisiones del 60Co:
1º caracterización de la respuesta de los 2 detectores: 60Co-caracterizada es el nombre del fichero (hecho)
2º coincidencias 22Na a 180º y a 157.5º: 22Na-180 y 22Na-157 (lo dejaremos hecho hoy)
3º coincidencia entre fotón de 60Co y evento de fondo del laboratorio (intentaremos dejarlo hecho hoy - 4 de mayo mañana)
4º por la tarde dejarán hecha la coincidencia entre eventos de fondo en los dos detectores (4 de mayo – tarde).
5º coincidencia 60Co a 180º (el miércoles 6 de mayo pondremos esta)
6º coincidencia 60Co a 157.5º (viernes 8 de mayo)
7º coincidencia 60Co a 135º (lunes 11 de mayo)
8º coincidencia 60Co a 112.5º (miércoles 13 de mayo)
9º coincidencia 60Co a 90º (viernes 15 de mayo, fin de semana por ser la que menos probabilidad tiene)
10º coincidencia 60Co a 67.5º (lunes 18 de mayo)
11º coincidencia 60Co a 45º (miércoles 20 de mayo)
12º coincidencia 60Co a 22.5º (viernes 22 de mayo, lunes 25 de mayo-fin)